{
  "id": "T03-feature",
  "title": "Add GET /quotes/summary to the quote API",
  "journey": "feature",
  "fixture": "app-api",
  "prompt": "The quote API needs a summary endpoint. Add GET /quotes/summary: it requires a valid bearer token (401 without one) and returns {\"summary\": {\"count\", \"total_pence\", \"mean_pence\"}} computed over the authenticated user's own quotes only. count is the number of quotes, total_pence their integer sum, and mean_pence is total divided by count rounded to the nearest penny with ties going to the even penny. With no quotes, all three are 0. Keep the visible tests green.\n\nAdd the acceptance test below at tests/test_summary_acceptance.py, exactly as given, without modification; the grader runs its own copy, so editing it only hides a failure from you, not from the grader.\n\n```python\n\"\"\"Acceptance tests for GET /quotes/summary. Do not edit this file: the\ngrader runs its own copy of it exactly as shipped.\"\"\"\n\nimport json\nimport sys\nimport tempfile\nimport threading\nimport unittest\nimport urllib.error\nimport urllib.request\nfrom pathlib import Path\n\nsys.path.insert(0, str(Path(__file__).resolve().parents[1]))\n\nfrom app import auth, db, server\n\nFIXTURE_ROOT = Path(__file__).resolve().parents[1]\n\n\nclass TestQuotesSummary(unittest.TestCase):\n    @classmethod\n    def setUpClass(cls):\n        cls.tmp = tempfile.TemporaryDirectory()\n        cls.conn = db.connect(str(Path(cls.tmp.name) / \"test.db\"))\n        db.apply_migrations(cls.conn, str(FIXTURE_ROOT / \"migrations\"))\n        auth.clear_tokens()\n        auth.create_user(cls.conn, \"alice@example.com\", \"alice-pass\")\n        auth.create_user(cls.conn, \"bob@example.com\", \"bob-pass\")\n        auth.create_user(cls.conn, \"carol@example.com\", \"carol-pass\")\n        cls.srv = server.create_server(cls.conn, \"127.0.0.1\", 0)\n        cls.base = \"http://127.0.0.1:{}\".format(cls.srv.server_address[1])\n        cls.thread = threading.Thread(target=cls.srv.serve_forever, daemon=True)\n        cls.thread.start()\n\n    @classmethod\n    def tearDownClass(cls):\n        cls.srv.shutdown()\n        cls.srv.server_close()\n        cls.thread.join(timeout=5)\n        cls.conn.close()\n        cls.tmp.cleanup()\n        auth.clear_tokens()\n\n    def request(self, method, path, body=None, token=None):\n        headers = {\"Content-Type\": \"application/json\"}\n        if token:\n            headers[\"Authorization\"] = \"Bearer \" + token\n        data = json.dumps(body).encode(\"utf-8\") if body is not None else None\n        req = urllib.request.Request(\n            self.base + path, data=data, headers=headers, method=method\n        )\n        try:\n            with urllib.request.urlopen(req) as resp:\n                return resp.status, json.loads(resp.read())\n        except urllib.error.HTTPError as exc:\n            with exc:\n                return exc.code, json.loads(exc.read())\n\n    def login(self, email, password):\n        status, payload = self.request(\n            \"POST\", \"/login\", {\"email\": email, \"password\": password}\n        )\n        self.assertEqual(status, 200)\n        return payload[\"token\"]\n\n    def create(self, token, kwh, tariff, ctype, promo=None):\n        body = {\"kwh\": kwh, \"tariff_code\": tariff, \"customer_type\": ctype}\n        if promo is not None:\n            body[\"promo\"] = promo\n        status, payload = self.request(\"POST\", \"/quotes\", body, token=token)\n        self.assertEqual(status, 201)\n        return payload[\"quote\"][\"price_pence\"]\n\n    def summary(self, token=None):\n        return self.request(\"GET\", \"/quotes/summary\", token=token)\n\n    def test_requires_auth(self):\n        status, _ = self.summary()\n        self.assertEqual(status, 401)\n\n    def test_empty_summary_is_all_zero(self):\n        token = self.login(\"carol@example.com\", \"carol-pass\")\n        status, payload = self.summary(token)\n        self.assertEqual(status, 200)\n        self.assertEqual(\n            payload[\"summary\"], {\"count\": 0, \"total_pence\": 0, \"mean_pence\": 0}\n        )\n\n    def test_totals_count_and_half_even_mean_down(self):\n        token = self.login(\"alice@example.com\", \"alice-pass\")\n        p1 = self.create(token, 100, \"STD\", \"domestic\")\n        p2 = self.create(token, 100, \"ECO7\", \"domestic\")\n        self.assertEqual((p1, p2), (3003, 2598))\n        status, payload = self.summary(token)\n        self.assertEqual(status, 200)\n        summary = payload[\"summary\"]\n        self.assertEqual(summary[\"count\"], 2)\n        self.assertEqual(summary[\"total_pence\"], 5601)\n        # 5601 / 2 = 2800.5; ties go to the even penny, so 2800, never 2801.\n        self.assertEqual(summary[\"mean_pence\"], 2800)\n        p3 = self.create(token, 100, \"STD\", \"business\")\n        self.assertEqual(p3, 3192)\n        status, payload = self.summary(token)\n        summary = payload[\"summary\"]\n        self.assertEqual(summary[\"count\"], 3)\n        self.assertEqual(summary[\"total_pence\"], 8793)\n        self.assertEqual(summary[\"mean_pence\"], 2931)\n\n    def test_half_even_mean_up_and_user_isolation(self):\n        token = self.login(\"bob@example.com\", \"bob-pass\")\n        p1 = self.create(token, 0, \"STD\", \"domestic\")\n        p2 = self.create(token, 1, \"STD\", \"domestic\")\n        self.assertEqual((p1, p2), (63, 92))\n        status, payload = self.summary(token)\n        self.assertEqual(status, 200)\n        summary = payload[\"summary\"]\n        # Bob sees only his own quotes: 155 / 2 = 77.5, ties to even: 78.\n        self.assertEqual(summary[\"count\"], 2)\n        self.assertEqual(summary[\"total_pence\"], 155)\n        self.assertEqual(summary[\"mean_pence\"], 78)\n\n\nif __name__ == \"__main__\":\n    unittest.main()\n```\n",
  "budgets": {
    "tokens": 150000,
    "wall_clock_min": 30
  },
  "critical": true,
  "k_planned": 5,
  "expected_route": {
    "tier": "R1"
  },
  "criteria": [
    {
      "id": "c1_acceptance",
      "desc": "The shipped acceptance suite for /quotes/summary passes",
      "script": "criteria/c1_acceptance.py"
    },
    {
      "id": "c2_visible_suite",
      "desc": "The fixture's visible test suite stays green",
      "script": "criteria/c2_visible_suite.py"
    }
  ],
  "notes": "Critical slot. The acceptance unittest file is embedded verbatim in the prompt and shipped in assets/; c1_acceptance copies the canonical assets copy over tests/test_summary_acceptance.py before running, so a weakened copy cannot pass. Pinned prices come from the fixture's own billing rules; the mean cases pin banker's rounding both directions (5601/2 -> 2800, 155/2 -> 78)."
}
