{
  "id": "T06-migration",
  "title": "Add migration 003: users.marketing_opt_in",
  "journey": "migration",
  "fixture": "app-api",
  "prompt": "Marketing consent is landing next sprint. Add migration 003 to the quote API: a marketing_opt_in flag on users, stored as an integer, defaulting to 0 for new rows, and every existing row must end up with 0 as well. Follow the conventions the existing migrations use and do not edit or renumber 001 or 002: app.db.apply_migrations must bring both a fresh database and an already-migrated database to the same schema. Keep the visible tests green.",
  "budgets": {
    "tokens": 150000,
    "wall_clock_min": 40
  },
  "critical": true,
  "k_planned": 5,
  "expected_route": {
    "tier": "R2"
  },
  "criteria": [
    {
      "id": "c1_fresh_db",
      "desc": "Migrations 001 to 003 give a fresh database the column with default 0",
      "script": "criteria/c1_fresh_db.py"
    },
    {
      "id": "c2_seeded_db",
      "desc": "An already-migrated, populated database gains the column with backfill 0 and no data loss",
      "script": "criteria/c2_seeded_db.py"
    },
    {
      "id": "c3_visible_suite",
      "desc": "The fixture's visible test suite stays green",
      "script": "criteria/c3_visible_suite.py"
    }
  ],
  "notes": "Critical slot. Schema changes route R2 under the v2 policy. Both database paths are exercised because ALTER TABLE defaults and backfill diverge easily on sqlite."
}
